URL,Version,Status,OIDs,Name,Title,Descriptino,Uses,Used,Sources
http://hl7.dk/fhir/core/ValueSet/DkCoreProfessionGroupValueSet,3.4.0,active,,DkCoreProfessionGroupValueSet,DK Profession Group,"DK Profession Group codes","StructureDefinition/medcom-core-practitioner","hl7.fhir.dk.core"
http://hl7.dk/fhir/core/ValueSet/dk-core-MunicipalityCodes,3.4.0,active,,MunicipalityCodes,DK Municipality Codes,"Municipality codes used in Denmark","StructureDefinition/medcom-core-organization","hl7.fhir.dk.core"
http://hl7.dk/fhir/core/ValueSet/dk-core-TechniquesSCTCodes,3.4.0,active,,TechniquesSCTCodes,DK TechniquesSCTCodes,"SNOMED CT Codes for the technique used when obtaining an observation","StructureDefinition/medcom-core-observation","SCT"
http://hl7.dk/fhir/core/ValueSet/dk-marital-status,3.4.0,active,,,DK MaritalStatus,"This value set defines the set of codes that can be used to indicate the marital status of a person in Denmark.","StructureDefinition/medcom-core-patient","hl7.fhir.dk.core"
http://hl7.dk/fhir/core/ValueSet/extended-patient-contactrelationship,3.4.0,active,,extended-patient-contactrelationship,DK Extended Patient Contact Relationship,"DK Extended Patient Contact Relationship","StructureDefinition/medcom-core-patient",
http://hl7.dk/fhir/core/ValueSet/sor-organization-type,3.4.0,active,,SorOrganizationType,DK SOR Organization Type,"Value set used for indicating the organization type for organizations from SOR","StructureDefinition/medcom-core-organization","SCT"
http://hl7.org/fhir/ValueSet/address-type,4.0.1,active,"2.16.840.1.113883.4.642.3.69",AddressType,AddressType,"The type of an address (physical / postal).","StructureDefinition/medcom-core-patient","hl7.fhir.r4.core"
http://hl7.org/fhir/ValueSet/address-use,4.0.1,active,"2.16.840.1.113883.4.642.3.67",AddressUse,AddressUse,"The use of an address.","StructureDefinition/medcom-core-patient","hl7.fhir.r4.core"
http://hl7.org/fhir/ValueSet/administrative-gender,4.0.1,active,"2.16.840.1.113883.4.642.3.1",AdministrativeGender,AdministrativeGender,"The gender of a person used for administrative purposes.","StructureDefinition/medcom-core-patient,StructureDefinition/medcom-core-practitioner","hl7.fhir.r4.core"
http://hl7.org/fhir/ValueSet/body-site,4.0.1,draft,"2.16.840.1.113883.4.642.3.141",SNOMEDCTBodyStructures,SNOMED CT Body Structures,"This value set includes all codes from [SNOMED CT](http://snomed.info/sct) where concept is-a 442083009 (Anatomical or acquired body site (body structure)).","StructureDefinition/medcom-core-media,StructureDefinition/medcom-core-observation","SCT"
http://hl7.org/fhir/ValueSet/c80-practice-codes,4.0.1,active,"2.16.840.1.113883.3.88.12.80.72",PracticeSettingCodeValueSet,Practice Setting Code Value Set,"This is the code representing the clinical specialty of the clinician or provider who interacted with, treated, or provided a service to/for the patient. The value set used for clinical specialty has been limited by HITSP to the value set reproduced from HITSP C80 Table 2-149 Clinical Specialty Value Set Definition.","StructureDefinition/medcom-core-practitionerrole","SCT"
http://hl7.org/fhir/ValueSet/care-team-category,4.0.1,draft,"2.16.840.1.113883.4.642.3.155",CareTeamCategory,Care Team category,"Indicates the type of care team.","StructureDefinition/medcom-core-careteam","LOINC"
http://hl7.org/fhir/ValueSet/care-team-status,4.0.1,draft,"2.16.840.1.113883.4.642.3.153",CareTeamStatus,CareTeamStatus,"Indicates the status of the care team.","StructureDefinition/medcom-core-careteam","hl7.fhir.r4.core"
http://hl7.org/fhir/ValueSet/clinical-findings,4.0.1,draft,"2.16.840.1.113883.4.642.3.232",SNOMEDCTClinicalFindings,SNOMED CT Clinical Findings,"This value set includes all the ""Clinical finding"" [SNOMED CT](http://snomed.info/sct) codes - concepts where concept is-a 404684003 (Clinical finding (finding)).","StructureDefinition/medcom-core-careteam,StructureDefinition/medcom-core-diagnosticreport","SCT"
http://hl7.org/fhir/ValueSet/contact-point-system,4.0.1,active,"2.16.840.1.113883.4.642.3.71",ContactPointSystem,ContactPointSystem,"Telecommunications form for contact point.","StructureDefinition/medcom-messaging-contactpoint,StructureDefinition/medcom-core-contact-extension","hl7.fhir.r4.core"
http://hl7.org/fhir/ValueSet/contact-point-use,4.0.1,active,"2.16.840.1.113883.4.642.3.73",ContactPointUse,ContactPointUse,"Use of contact point.","StructureDefinition/medcom-messaging-contactpoint,StructureDefinition/medcom-core-contact-extension","hl7.fhir.r4.core"
http://hl7.org/fhir/ValueSet/contactentity-type,4.0.1,draft,"2.16.840.1.113883.4.642.3.416",ContactEntityType,Contact entity type,"This example value set defines a set of codes that can be used to indicate the purpose for which you would contact a contact party.","StructureDefinition/medcom-core-organization","THO"
http://hl7.org/fhir/ValueSet/data-absent-reason,4.0.1,active,"2.16.840.1.113883.4.642.3.5",DataAbsentReason,DataAbsentReason,"Used to specify why the normally expected content of the data element is missing.","StructureDefinition/medcom-core-observation","THO"
http://hl7.org/fhir/ValueSet/days-of-week,4.0.1,active,"2.16.840.1.113883.4.642.3.512",DaysOfWeek,DaysOfWeek,"The days of the week.","StructureDefinition/medcom-core-practitionerrole","hl7.fhir.r4.core"
http://hl7.org/fhir/ValueSet/diagnosis-role,4.0.1,draft,"2.16.840.1.113883.4.642.3.49",DiagnosisRole,DiagnosisRole,"This value set defines a set of codes that can be used to express the role of a diagnosis on the Encounter or EpisodeOfCare record.","StructureDefinition/medcom-core-encounter","THO"
http://hl7.org/fhir/ValueSet/diagnostic-service-sections,4.0.1,draft,"2.16.840.1.113883.4.642.3.234",DiagnosticServiceSectionCodes,Diagnostic Service Section Codes,"This value set includes all the codes in HL7 V2 table 0074.","StructureDefinition/medcom-core-diagnosticreport","THO (V2)"
http://hl7.org/fhir/ValueSet/encounter-admit-source,4.0.1,draft,"2.16.840.1.113883.4.642.3.257",AdmitSource,Admit source,"This value set defines a set of codes that can be used to indicate from where the patient came in.","StructureDefinition/medcom-core-encounter","THO"
http://hl7.org/fhir/ValueSet/encounter-diet,4.0.1,draft,"2.16.840.1.113883.4.642.3.255",Diet,Diet,"This value set defines a set of codes that can be used to indicate dietary preferences or restrictions a patient may have.","StructureDefinition/medcom-core-encounter","THO"
http://hl7.org/fhir/ValueSet/encounter-discharge-disposition,4.0.1,draft,"2.16.840.1.113883.4.642.3.259",DischargeDisposition,Discharge disposition,"This value set defines a set of codes that can be used to where the patient left the hospital.","StructureDefinition/medcom-core-encounter","THO"
http://hl7.org/fhir/ValueSet/encounter-location-status,4.0.1,draft,"2.16.840.1.113883.4.642.3.262",EncounterLocationStatus,EncounterLocationStatus,"The status of the location.","StructureDefinition/medcom-core-encounter","hl7.fhir.r4.core"
http://hl7.org/fhir/ValueSet/encounter-participant-type,4.0.1,draft,"2.16.840.1.113883.4.642.3.250",ParticipantType,Participant type,"This value set defines a set of codes that can be used to indicate how an individual participates in an encounter.","StructureDefinition/medcom-core-encounter","THO (V3),THO"
http://hl7.org/fhir/ValueSet/encounter-reason,4.0.1,draft,"2.16.840.1.113883.4.642.3.261",EncounterReasonCodes,Encounter Reason Codes,"This examples value set defines the set of codes that can be used to indicate reasons for an encounter.","StructureDefinition/medcom-core-encounter","SCT"
http://hl7.org/fhir/ValueSet/encounter-special-arrangements,4.0.1,draft,"2.16.840.1.113883.4.642.3.253",SpecialArrangements,Special arrangements,"This value set defines a set of codes that can be used to indicate the kinds of special arrangements in place for a patients visit.","StructureDefinition/medcom-core-encounter","THO"
http://hl7.org/fhir/ValueSet/encounter-special-courtesy,4.0.1,draft,"2.16.840.1.113883.4.642.3.252",SpecialCourtesy,Special courtesy,"This value set defines a set of codes that can be used to indicate special courtesies provided to the patient.","StructureDefinition/medcom-core-encounter","THO (V3)"
http://hl7.org/fhir/ValueSet/encounter-status,4.0.1,draft,"2.16.840.1.113883.4.642.3.246",EncounterStatus,EncounterStatus,"Current state of the encounter.","StructureDefinition/medcom-core-encounter","hl7.fhir.r4.core"
http://hl7.org/fhir/ValueSet/encounter-type,4.0.1,draft,"2.16.840.1.113883.4.642.3.248",EncounterType,Encounter type,"This example value set defines a set of codes that can be used to indicate the type of encounter: a specific code indicating type of service provided.","StructureDefinition/medcom-core-encounter","THO"
http://hl7.org/fhir/ValueSet/event-status,4.0.1,draft,"2.16.840.1.113883.4.642.3.109",EventStatus,EventStatus,"Codes identifying the lifecycle stage of an event.","StructureDefinition/medcom-core-media","hl7.fhir.r4.core"
http://hl7.org/fhir/ValueSet/identifier-type,4.0.1,active,"2.16.840.1.113883.4.642.3.45",Identifier Type Codes,IdentifierType,"A coded type for an identifier that can be used to determine which identifier to use for a specific purpose.","StructureDefinition/medcom-core-observation,StructureDefinition/medcom-assigned-identifier,StructureDefinition/medcom-core-organization,StructureDefinition/medcom-core-diagnosticreport,StructureDefinition/lpr3-Identifier","THO (V2)"
http://hl7.org/fhir/ValueSet/identifier-use,4.0.1,active,"2.16.840.1.113883.4.642.3.57",IdentifierUse,IdentifierUse,"Identifies the purpose for this identifier, if known .","StructureDefinition/medcom-core-observation,StructureDefinition/medcom-assigned-identifier,StructureDefinition/medcom-core-organization,StructureDefinition/medcom-core-diagnosticreport,StructureDefinition/lpr3-Identifier","hl7.fhir.r4.core"
http://hl7.org/fhir/ValueSet/languages,4.0.1,draft,"2.16.840.1.113883.4.642.3.20",CommonLanguages,Common Languages,"This value set includes common codes from BCP-47 (http://tools.ietf.org/html/bcp47)","StructureDefinition/medcom-core-media,StructureDefinition/medcom-core-observation,StructureDefinition/medcom-core-careteam,StructureDefinition/medcom-core-practitionerrole,StructureDefinition/medcom-core-organization,StructureDefinition/medcom-core-encounter,StructureDefinition/medcom-core-diagnosticreport,StructureDefinition/medcom-core-patient,StructureDefinition/medcom-core-practitioner","hl7.terminology.r4"
http://hl7.org/fhir/ValueSet/link-type,4.0.1,active,"2.16.840.1.113883.4.642.3.423",LinkType,LinkType,"The type of link between this patient resource and another patient resource.","StructureDefinition/medcom-core-patient","hl7.fhir.r4.core"
http://hl7.org/fhir/ValueSet/location-physical-type,4.0.1,draft,"2.16.840.1.113883.4.642.3.328",LocationType,Location type,"This example value set defines a set of codes that can be used to indicate the physical form of the Location.","StructureDefinition/medcom-core-encounter","THO"
http://hl7.org/fhir/ValueSet/media-modality,4.0.1,draft,"2.16.840.1.113883.4.642.3.1001",MediaModality,Media Modality,"Detailed information about the type of the image - its kind, purpose, or the kind of equipment used to generate it.","StructureDefinition/medcom-core-media","THO"
http://hl7.org/fhir/ValueSet/media-type,4.0.1,draft,"2.16.840.1.113883.4.642.3.1000",MediaType,Media Type,"Codes for high level media categories.","StructureDefinition/medcom-core-media","THO"
http://hl7.org/fhir/ValueSet/media-view,4.0.1,draft,"2.16.840.1.113883.4.642.3.337",MediaCollectionView/Projection,Media Collection View/Projection,"Codes defined in SNOMED CT that can be used to record Media Recording views.","StructureDefinition/medcom-core-media","SCT"
http://hl7.org/fhir/ValueSet/name-use,4.0.1,active,"2.16.840.1.113883.4.642.3.65",NameUse,NameUse,"The use of a human name.","StructureDefinition/medcom-core-patient","hl7.fhir.r4.core"
http://hl7.org/fhir/ValueSet/narrative-status,4.0.1,draft,"2.16.840.1.113883.4.642.3.55",NarrativeStatus,NarrativeStatus,"The status of a resource narrative.","StructureDefinition/medcom-core-careteam,StructureDefinition/medcom-core-practitionerrole,StructureDefinition/medcom-core-organization,StructureDefinition/medcom-core-encounter,StructureDefinition/medcom-core-patient,StructureDefinition/medcom-core-practitioner","hl7.fhir.r4.core"
http://hl7.org/fhir/ValueSet/observation-category,4.0.1,draft,"2.16.840.1.113883.4.642.3.403",ObservationCategoryCodes,Observation Category Codes,"Observation Category codes.","StructureDefinition/medcom-core-observation","THO"
http://hl7.org/fhir/ValueSet/observation-codes,4.0.1,draft,"2.16.840.1.113883.4.642.3.396",LOINCCodes,LOINC Codes,"This value set includes all LOINC codes","StructureDefinition/medcom-core-observation","LOINC"
http://hl7.org/fhir/ValueSet/observation-interpretation,4.0.1,active,"2.16.840.1.113883.4.642.3.399",ObservationInterpretationCodes,Observation Interpretation Codes,"A categorical assessment, providing a rough qualitative interpretation of the observation value,    such as “normal”/ “abnormal”,”low” / “high”, “better” / “worse”, “susceptible” / “resistant”, “expected”/ “not expected”.    The value set is intended to be for ANY use where coded representation of an interpretation is needed.             Notes:          This is being communicated in v2.x in OBX-8 (Observation Interpretation), in v3 in ObservationInterpretation (CWE) in R1 (Representative Realm) and in FHIR in    Observation.interpretation. Historically these values come from the laboratory domain, and these codes are extensively    used. The value set binding is extensible, so codes outside the value set that are needed for interpretation concepts    (i.e. particular meanings) that are not included in the value set can be used, and these new codes may also be added to    the value set and published in a future version.","StructureDefinition/medcom-core-observation","THO (V3)"
http://hl7.org/fhir/ValueSet/observation-methods,4.0.1,draft,"2.16.840.1.113883.4.642.3.395",ObservationMethods,Observation Methods,"Observation Method codes from [SNOMED CT](http://snomed.info/sct) where concept is-a 272394005 (Technique (qualifier value)) or is-a 129264002 (Action (qualifier value)) or is-a 386053000 (Evaluation procedure(procedure))","StructureDefinition/medcom-core-observation","SCT"
http://hl7.org/fhir/ValueSet/participant-role,4.0.1,draft,"2.16.840.1.113883.4.642.3.152",ParticipantRoles,Participant Roles,"Roles of participants that may be included in a care team.  Defined as: Is a Person, Healthcare professional (occupation) or Healthcare related organization (qualifier value).","StructureDefinition/medcom-core-careteam","SCT"
http://hl7.org/fhir/ValueSet/procedure-reason,4.0.1,draft,"2.16.840.1.113883.4.642.3.432",ProcedureReasonCodes,Procedure Reason Codes,"This example value set defines the set of codes that can be used to indicate a reason for a procedure.","StructureDefinition/medcom-core-media","SCT"
http://hl7.org/fhir/ValueSet/quantity-comparator,4.0.1,active,"2.16.840.1.113883.4.642.3.59",QuantityComparator,QuantityComparator,"How the Quantity should be understood and represented.","StructureDefinition/medcom-core-observation","hl7.fhir.r4.core"
http://hl7.org/fhir/ValueSet/referencerange-appliesto,4.0.1,draft,"2.16.840.1.113883.4.642.3.407",ObservationReferenceRangeAppliesToCodes,Observation Reference Range Applies To Codes,"This value set defines a set of codes that can be used to indicate the particular target population the reference range applies to.","StructureDefinition/medcom-core-observation","SCT"
http://hl7.org/fhir/ValueSet/referencerange-meaning,4.0.1,draft,"2.16.840.1.113883.4.642.3.397",ObservationReferenceRangeMeaningCodes,Observation Reference Range Meaning Codes,"This value set defines a set of codes that can be used to indicate the meaning/use of a reference range for a particular target population.","StructureDefinition/medcom-core-observation","THO"
http://hl7.org/fhir/ValueSet/resource-types,4.0.1,active,"2.16.840.1.113883.4.642.3.27",ResourceType,ResourceType,"One of the resource types defined as part of this version of FHIR.","StructureDefinition/medcom-core-encounter,StructureDefinition/medcom-core-patient","hl7.fhir.r4.core"
http://hl7.org/fhir/ValueSet/service-type,4.0.1,draft,"2.16.840.1.113883.4.642.3.518",ServiceType,Service type,"This value set defines an example set of codes of service-types.","StructureDefinition/medcom-core-encounter","THO"
http://medcomfhir.dk/ig/terminology/ValueSet/MedComDiagnosticReportCodesValueset,1.8.1,draft,,MedComDiagnosticReportCodesValueset,MedComDiagnosticReportCodesValueset,"ValueSet with codes that represents the name of the diagnostic report.","StructureDefinition/medcom-core-diagnosticreport","medcom.fhir.dk.terminology"
http://medcomfhir.dk/ig/terminology/ValueSet/medcom-core-PractitionerRoles,2.0.0,active,,MedComCorePractitionerRoles,MedComCorePractitionerRoles,"ValueSet containing codes for practionerroles (Danish: Stillingsbetegnelser) from MedCom.","StructureDefinition/medcom-core-practitionerrole","THO (V3),medcom.fhir.dk.terminology"
http://medcomfhir.dk/ig/terminology/ValueSet/medcom-core-attachmentMimeTypes,1.8.1,active,,MedComCoreAttachmentMimeTypes,MedComCoreAttachmentMimeTypes,"ValueSet containing allowed mime types for MedCom messages","StructureDefinition/medcom-core-media","Other"
http://medcomfhir.dk/ig/terminology/ValueSet/medcom-core-encounter-class,2.0.0,active,,MedComCoreEncounterClass,MedComCoreEncounterClassCodes,"ValueSet containing classification codes for MedComCoreEncounter.","StructureDefinition/medcom-core-encounter","THO (V3),medcom.fhir.dk.terminology"
http://medcomfhir.dk/ig/terminology/ValueSet/medcom-core-observation-status,1.8.1,active,,MedComCoreObservationStatus,MedComCoreObservationStatus,"ValueSet containing status codes for MedCom Core Observation","StructureDefinition/medcom-core-observation","hl7.fhir.r4.core"
http://medcomfhir.dk/ig/terminology/ValueSet/medcom-corediagnosticreport-status,1.8.1,active,,MedComCoreDiagnosticReportStatus,MedComCoreDiagnosticReportStatus,"ValueSet containing status codes for MedCom DiagnosticReport","StructureDefinition/medcom-core-diagnosticreport","hl7.fhir.r4.core"
http://terminology.hl7.org/ValueSet/v2-0092,2.0.0,active,"2.16.840.1.113883.21.40",Hl7VSReAdmissionIndicator,hl7VS-re-admissionIndicator,"Value Set of codes which are used to specify that a patient is being re-admitted to a healthcare facility from which they were discharged, and indicates the circumstances around such re-admission.","StructureDefinition/medcom-core-encounter","THO (V2)"
http://terminology.hl7.org/ValueSet/v2-2.7-0360,0360,active,,v2.0360.2.7,v2 table 0360, Version 2.7,"FHIR Value set/code system definition for HL7 v2 table 0360 ver 2.9 ( Degree/License/Certificate)","StructureDefinition/medcom-core-practitioner","THO (V2)"
http://terminology.hl7.org/ValueSet/v3-ActEncounterCode,3.0.0,active,"2.16.840.1.113883.1.11.13955",ActEncounterCode,ActEncounterCode,"Domain provides codes that qualify the ActEncounterClass (ENC)","StructureDefinition/medcom-core-encounter","THO (V3)"
http://terminology.hl7.org/ValueSet/v3-ActPriority,3.0.0,active,"2.16.840.1.113883.1.11.16866",ActPriority,ActPriority,"A code or set of codes (e.g., for routine, emergency,) specifying the urgency under which the Act happened, can happen, is happening, is intended to happen, or is requested/demanded to happen.    *Discussion:* This attribute is used in orders to indicate the ordered priority, and in event documentation it indicates the actual priority used to perform the act. In definition mood it indicates the available priorities.","StructureDefinition/medcom-core-encounter","THO (V3)"
