URL,Version,Status,OIDs,Name,Title,Descriptino,Used
http://medcomfhir.dk/ig/terminology/CodeSystem/medcom-acknowledgement-issue-details,1.0.0,draft,,MedComAcknowledgementIssueDetails,MedComAcknowledgementIssueDetails,"CodeSystem including detailed issues describtions. This CodeSystem is intended to be extended in collaboration the IT-vendors.",
http://medcomfhir.dk/ig/terminology/CodeSystem/medcom-careCommunication-categoryCodes,1.0.0,active,,MedComCareCommunicationCategoryCodes,MedComCareCommunicationCategories,"Category codes for care communication messages",
http://medcomfhir.dk/ig/terminology/CodeSystem/medcom-core-ecpr-codes,1.0.0,active,,MedComCoreECPRCodes,MedComCoreECPRCodes,"CodeSystem with systems used to represent the system of a Danish replacement person identifier (eCPR).",
http://medcomfhir.dk/ig/terminology/CodeSystem/medcom-core-encounter-act-codes,1.0.0,active,,MedComCoreEncounterActCodes,MedComCoreEncounterActCodes,"CodeSystem with code for classification of an encounter.",
http://medcomfhir.dk/ig/terminology/CodeSystem/medcom-messaging-activityCodes,1.0.0,active,,MedComMessagingActivityCodes,MedComMessagingActivityCodes,"CodeSystem containing codes for activities occuring in MedCom messages",
http://medcomfhir.dk/ig/terminology/CodeSystem/medcom-messaging-destinationUse,1.0.0,active,,MedComMessagingDesinationUseCodes,MedComMessagingDestinationUse,"Codes indicatin whether the use of a destination in a MedCom message header is as a primary or a carbon copy recipient of the message",
http://medcomfhir.dk/ig/terminology/CodeSystem/medcom-messaging-eventCodes,1.0.0,active,,MedComMessageEventCodes,MedComMessagingEventCodes,"CodeSystem including all types of MedCom messages",
http://medcomfhir.dk/ig/terminology/CodeSystem/medcom-messaging-sorEdiSystem,1.0.0,active,,MedComMessagingSorEdiSystem,MedComMessagingSorEdiCodeSystem,"Codes for SOREDI message types",
http://medcomfhir.dk/ig/terminology/CodeSystem/medcom-messaging-statisticalCodes,1.0.0,active,,MedComMessagingStatisticalCodes,MedComMessagingStatisticalCodes,"Statistical Codes for MedCom VANS messages",
